{"schema_version":"tokenbench.study-policy/v2","study_id":"quality-study","tasks":[{"task_id":"task-01","suite_sha256":"aaaaaaaaaaaaaaaaaaaaaaaaaaaaaaaaaaaaaaaaaaaaaaaaaaaaaaaaaaaaaaaa","prompt_sha256":"bbbbbbbbbbbbbbbbbbbbbbbbbbbbbbbbbbbbbbbbbbbbbbbbbbbbbbbbbbbbbbbb","repository_cluster_id":"repository-main","task_family":"explain","status":"included","exclusion_reason":"","repetitions":1,"facts":[{"item_id":"fact.location","requirement":"States the defined location.","expected":"The location is internal/config.","maximum_points":2}],"rubric":[{"item_id":"rubric.explanation","requirement":"Explains the result with repository-grounded evidence.","maximum_points":3}]},{"task_id":"task-02","suite_sha256":"aaaaaaaaaaaaaaaaaaaaaaaaaaaaaaaaaaaaaaaaaaaaaaaaaaaaaaaaaaaaaaaa","prompt_sha256":"bbbbbbbbbbbbbbbbbbbbbbbbbbbbbbbbbbbbbbbbbbbbbbbbbbbbbbbbbbbbbbbb","repository_cluster_id":"repository-main","task_family":"explain","status":"included","exclusion_reason":"","repetitions":1,"facts":[{"item_id":"fact.location","requirement":"States the defined location.","expected":"The location is internal/config.","maximum_points":2}],"rubric":[{"item_id":"rubric.explanation","requirement":"Explains the result with repository-grounded evidence.","maximum_points":3}]},{"task_id":"zz-pilot","suite_sha256":"aaaaaaaaaaaaaaaaaaaaaaaaaaaaaaaaaaaaaaaaaaaaaaaaaaaaaaaaaaaaaaaa","prompt_sha256":"bbbbbbbbbbbbbbbbbbbbbbbbbbbbbbbbbbbbbbbbbbbbbbbbbbbbbbbbbbbbbbbb","repository_cluster_id":"repository-main","task_family":"explain","status":"excluded","exclusion_reason":"Pilot task retained outside confirmatory analysis.","repetitions":1,"facts":[{"item_id":"fact.location","requirement":"States the defined location.","expected":"The location is internal/config.","maximum_points":2}],"rubric":[{"item_id":"rubric.explanation","requirement":"Explains the result with repository-grounded evidence.","maximum_points":3}]}],"exclusion_reasons":[{"code":"integrity_failure","description":"An independently recorded integrity check failed."}],"quality":{"minimum_answer_score_ppm":800000,"minimum_candidate_pass_rate_ppm":1000000,"noninferiority_margin_ppm":50000,"prose_evaluator_ids":["judge-alpha","judge-beta"],"prose_aggregation":"arithmetic_mean"},"analysis":{"minimum_complete_pairs":2,"minimum_complete_tasks":2,"maximum_failed_pairs":0,"maximum_excluded_pairs":0,"maximum_not_attempted_pairs":0,"maximum_missing_answer_pairs":0,"maximum_quality_missing_pairs":0,"minimum_token_reduction_ppm":100000,"alpha_ppm":200000,"confidence_level_ppm":800000,"exact_randomization_max_clusters":8,"monte_carlo_samples":1000,"bootstrap_samples":1000},"seeds":{"blinding_sha256":"1b1edf88ac3f604020dadc7a16f6bdc086c71a2aaa82cf8fc7665127af681aee","randomization_sha256":"44a77d0378251499cdd9c498b140841753e2b146f51eff6e028a18ba195f7774","bootstrap_sha256":"30a41c09f65d957e86f00eb3a1395754a52d9a5dd7f3557f5dd759fc741094d7"}}
